Before CTE Training: train eu loss: 1.3789008855819702, eval eu loss: 1.4559847116470337
Before CTE Training: train eu acc: 0.50543212890625, eval eu acc: 0.58447265625
epoch   0 summary: dyn_dyn_loss   : 0.11041, dyn_sta_loss   : 4.07485, tot_dyn_loss   : 0.26899, sta_sta_loss   : 0.13266, 
train loss: 1.372364, train acc: 0.7039
epoch   1 summary: dyn_dyn_loss   : 0.10566, dyn_sta_loss   : 3.66321, tot_dyn_loss   : 0.24796, sta_sta_loss   : 0.13266, 
epoch   2 summary: dyn_dyn_loss   : 0.09929, dyn_sta_loss   : 3.36093, tot_dyn_loss   : 0.22976, sta_sta_loss   : 0.13266, 
epoch   3 summary: dyn_dyn_loss   : 0.09082, dyn_sta_loss   : 3.20460, tot_dyn_loss   : 0.21537, sta_sta_loss   : 0.13266, 
epoch   4 summary: dyn_dyn_loss   : 0.07811, dyn_sta_loss   : 3.18202, tot_dyn_loss   : 0.20227, sta_sta_loss   : 0.13266, 
epoch   5 summary: dyn_dyn_loss   : 0.06701, dyn_sta_loss   : 3.19006, tot_dyn_loss   : 0.19193, sta_sta_loss   : 0.13266, 
epoch   6 summary: dyn_dyn_loss   : 0.05818, dyn_sta_loss   : 3.20007, tot_dyn_loss   : 0.18385, sta_sta_loss   : 0.13266, 
epoch   7 summary: dyn_dyn_loss   : 0.05202, dyn_sta_loss   : 3.20655, tot_dyn_loss   : 0.17820, sta_sta_loss   : 0.13266, 
epoch   8 summary: dyn_dyn_loss   : 0.04758, dyn_sta_loss   : 3.21526, tot_dyn_loss   : 0.17429, sta_sta_loss   : 0.13266, 
epoch   9 summary: dyn_dyn_loss   : 0.04471, dyn_sta_loss   : 3.21970, tot_dyn_loss   : 0.17171, sta_sta_loss   : 0.13266, 
epoch  10 summary: dyn_dyn_loss   : 0.04263, dyn_sta_loss   : 3.22271, tot_dyn_loss   : 0.16983, sta_sta_loss   : 0.13266, 
train loss: 0.452657, train acc: 0.8755
epoch  11 summary: dyn_dyn_loss   : 0.04124, dyn_sta_loss   : 3.21749, tot_dyn_loss   : 0.16829, sta_sta_loss   : 0.13266, 
epoch  12 summary: dyn_dyn_loss   : 0.04008, dyn_sta_loss   : 3.22501, tot_dyn_loss   : 0.16748, sta_sta_loss   : 0.13266, 
epoch  13 summary: dyn_dyn_loss   : 0.03898, dyn_sta_loss   : 3.22993, tot_dyn_loss   : 0.16662, sta_sta_loss   : 0.13266, 
epoch  14 summary: dyn_dyn_loss   : 0.03836, dyn_sta_loss   : 3.23218, tot_dyn_loss   : 0.16611, sta_sta_loss   : 0.13266, 
epoch  15 summary: dyn_dyn_loss   : 0.03770, dyn_sta_loss   : 3.23501, tot_dyn_loss   : 0.16560, sta_sta_loss   : 0.13266, 
epoch  16 summary: dyn_dyn_loss   : 0.03716, dyn_sta_loss   : 3.23279, tot_dyn_loss   : 0.16499, sta_sta_loss   : 0.13266, 
epoch  17 summary: dyn_dyn_loss   : 0.03677, dyn_sta_loss   : 3.22314, tot_dyn_loss   : 0.16422, sta_sta_loss   : 0.13266, 
epoch  18 summary: dyn_dyn_loss   : 0.03655, dyn_sta_loss   : 3.23418, tot_dyn_loss   : 0.16446, sta_sta_loss   : 0.13266, 
epoch  19 summary: dyn_dyn_loss   : 0.03605, dyn_sta_loss   : 3.23624, tot_dyn_loss   : 0.16406, sta_sta_loss   : 0.13266, 
epoch  20 summary: dyn_dyn_loss   : 0.03584, dyn_sta_loss   : 3.23569, tot_dyn_loss   : 0.16383, sta_sta_loss   : 0.13266, 
train loss: 0.470216, train acc: 0.8777
epoch  21 summary: dyn_dyn_loss   : 0.03561, dyn_sta_loss   : 3.22985, tot_dyn_loss   : 0.16338, sta_sta_loss   : 0.13266, 
epoch  22 summary: dyn_dyn_loss   : 0.03529, dyn_sta_loss   : 3.23945, tot_dyn_loss   : 0.16346, sta_sta_loss   : 0.13266, 
epoch  23 summary: dyn_dyn_loss   : 0.03518, dyn_sta_loss   : 3.23033, tot_dyn_loss   : 0.16299, sta_sta_loss   : 0.13266, 
epoch  24 summary: dyn_dyn_loss   : 0.03489, dyn_sta_loss   : 3.23369, tot_dyn_loss   : 0.16284, sta_sta_loss   : 0.13266, 
epoch  25 summary: dyn_dyn_loss   : 0.03475, dyn_sta_loss   : 3.23755, tot_dyn_loss   : 0.16286, sta_sta_loss   : 0.13266, 
epoch  26 summary: dyn_dyn_loss   : 0.03459, dyn_sta_loss   : 3.24382, tot_dyn_loss   : 0.16296, sta_sta_loss   : 0.13266, 
epoch  27 summary: dyn_dyn_loss   : 0.03459, dyn_sta_loss   : 3.23402, tot_dyn_loss   : 0.16257, sta_sta_loss   : 0.13266, 
epoch  28 summary: dyn_dyn_loss   : 0.03445, dyn_sta_loss   : 3.24156, tot_dyn_loss   : 0.16274, sta_sta_loss   : 0.13266, 
epoch  29 summary: dyn_dyn_loss   : 0.03437, dyn_sta_loss   : 3.23519, tot_dyn_loss   : 0.16240, sta_sta_loss   : 0.13266, 
epoch  30 summary: dyn_dyn_loss   : 0.03429, dyn_sta_loss   : 3.23746, tot_dyn_loss   : 0.16242, sta_sta_loss   : 0.13266, 
train loss: 0.489632, train acc: 0.8657
epoch  31 summary: dyn_dyn_loss   : 0.03432, dyn_sta_loss   : 3.23080, tot_dyn_loss   : 0.16218, sta_sta_loss   : 0.13266, 
epoch  32 summary: dyn_dyn_loss   : 0.03418, dyn_sta_loss   : 3.24209, tot_dyn_loss   : 0.16250, sta_sta_loss   : 0.13266, 
epoch  33 summary: dyn_dyn_loss   : 0.03416, dyn_sta_loss   : 3.22752, tot_dyn_loss   : 0.16189, sta_sta_loss   : 0.13266, 
epoch  34 summary: dyn_dyn_loss   : 0.03419, dyn_sta_loss   : 3.22711, tot_dyn_loss   : 0.16191, sta_sta_loss   : 0.13266, 
epoch  35 summary: dyn_dyn_loss   : 0.03398, dyn_sta_loss   : 3.24245, tot_dyn_loss   : 0.16232, sta_sta_loss   : 0.13266, 
epoch  36 summary: dyn_dyn_loss   : 0.03397, dyn_sta_loss   : 3.23522, tot_dyn_loss   : 0.16202, sta_sta_loss   : 0.13266, 
epoch  37 summary: dyn_dyn_loss   : 0.03413, dyn_sta_loss   : 3.23272, tot_dyn_loss   : 0.16207, sta_sta_loss   : 0.13266, 
epoch  38 summary: dyn_dyn_loss   : 0.03392, dyn_sta_loss   : 3.22928, tot_dyn_loss   : 0.16174, sta_sta_loss   : 0.13266, 
epoch  39 summary: dyn_dyn_loss   : 0.03391, dyn_sta_loss   : 3.24234, tot_dyn_loss   : 0.16225, sta_sta_loss   : 0.13266, 
epoch  40 summary: dyn_dyn_loss   : 0.03376, dyn_sta_loss   : 3.23148, tot_dyn_loss   : 0.16167, sta_sta_loss   : 0.13266, 
train loss: 0.519516, train acc: 0.8674
epoch  41 summary: dyn_dyn_loss   : 0.03388, dyn_sta_loss   : 3.23345, tot_dyn_loss   : 0.16186, sta_sta_loss   : 0.13266, 
epoch  42 summary: dyn_dyn_loss   : 0.03376, dyn_sta_loss   : 3.23394, tot_dyn_loss   : 0.16177, sta_sta_loss   : 0.13266, 
epoch  43 summary: dyn_dyn_loss   : 0.03369, dyn_sta_loss   : 3.23413, tot_dyn_loss   : 0.16170, sta_sta_loss   : 0.13266, 
epoch  44 summary: dyn_dyn_loss   : 0.03362, dyn_sta_loss   : 3.23026, tot_dyn_loss   : 0.16148, sta_sta_loss   : 0.13266, 
epoch  45 summary: dyn_dyn_loss   : 0.03362, dyn_sta_loss   : 3.23369, tot_dyn_loss   : 0.16162, sta_sta_loss   : 0.13266, 
epoch  46 summary: dyn_dyn_loss   : 0.03364, dyn_sta_loss   : 3.22517, tot_dyn_loss   : 0.16130, sta_sta_loss   : 0.13266, 
epoch  47 summary: dyn_dyn_loss   : 0.03364, dyn_sta_loss   : 3.23075, tot_dyn_loss   : 0.16153, sta_sta_loss   : 0.13266, 
epoch  48 summary: dyn_dyn_loss   : 0.03361, dyn_sta_loss   : 3.22397, tot_dyn_loss   : 0.16122, sta_sta_loss   : 0.13266, 
epoch  49 summary: dyn_dyn_loss   : 0.03373, dyn_sta_loss   : 3.22649, tot_dyn_loss   : 0.16144, sta_sta_loss   : 0.13266, 
train loss: 0.489778, train acc: 0.8734
all                          30938.078ms
all_epoch                    29189.122ms
all_preparation               1748.936ms
all_preparation_2             1747.789ms
all_preparation_3                1.127ms
epoch                          463.956ms
epoch_pos_train                  1.949ms
epoch_preparation                3.844ms
epoch_train                    454.979ms
epoch_valid                      2.869ms
----------------------------------------
all                          30938.078ms
  all_epoch             94.35%
  all_preparation        5.65%
all_preparation               1748.936ms
  all_preparation_2     99.93%
  all_preparation_3      0.06%
epoch                        23197.812ms
  epoch_train           98.06%
  epoch_preparation      0.83%
  epoch_valid            0.62%
  epoch_pos_train        0.42%
epoch   0 summary: tot_dyn_loss   : 0.09182, 
valid loss: 3.821556, valid acc: 0.1938
epoch   1 summary: tot_dyn_loss   : 0.05907, 
epoch   2 summary: tot_dyn_loss   : 0.04348, 
epoch   3 summary: tot_dyn_loss   : 0.03493, 
epoch   4 summary: tot_dyn_loss   : 0.03026, 
epoch   5 summary: tot_dyn_loss   : 0.02746, 
epoch   6 summary: tot_dyn_loss   : 0.02602, 
epoch   7 summary: tot_dyn_loss   : 0.02512, 
epoch   8 summary: tot_dyn_loss   : 0.02442, 
epoch   9 summary: tot_dyn_loss   : 0.02394, 
epoch  10 summary: tot_dyn_loss   : 0.02374, 
valid loss: 2.842671, valid acc: 0.4204
epoch  11 summary: tot_dyn_loss   : 0.02366, 
epoch  12 summary: tot_dyn_loss   : 0.02340, 
epoch  13 summary: tot_dyn_loss   : 0.02353, 
epoch  14 summary: tot_dyn_loss   : 0.02345, 
epoch  15 summary: tot_dyn_loss   : 0.02331, 
epoch  16 summary: tot_dyn_loss   : 0.02334, 
epoch  17 summary: tot_dyn_loss   : 0.02326, 
epoch  18 summary: tot_dyn_loss   : 0.02320, 
epoch  19 summary: tot_dyn_loss   : 0.02336, 
epoch  20 summary: tot_dyn_loss   : 0.02323, 
valid loss: 2.817321, valid acc: 0.4219
epoch  21 summary: tot_dyn_loss   : 0.02331, 
epoch  22 summary: tot_dyn_loss   : 0.02322, 
epoch  23 summary: tot_dyn_loss   : 0.02329, 
epoch  24 summary: tot_dyn_loss   : 0.02316, 
epoch  25 summary: tot_dyn_loss   : 0.02313, 
epoch  26 summary: tot_dyn_loss   : 0.02314, 
epoch  27 summary: tot_dyn_loss   : 0.02323, 
epoch  28 summary: tot_dyn_loss   : 0.02321, 
epoch  29 summary: tot_dyn_loss   : 0.02330, 
epoch  30 summary: tot_dyn_loss   : 0.02325, 
valid loss: 2.841780, valid acc: 0.4194
epoch  31 summary: tot_dyn_loss   : 0.02335, 
epoch  32 summary: tot_dyn_loss   : 0.02313, 
epoch  33 summary: tot_dyn_loss   : 0.02319, 
epoch  34 summary: tot_dyn_loss   : 0.02312, 
epoch  35 summary: tot_dyn_loss   : 0.02320, 
epoch  36 summary: tot_dyn_loss   : 0.02334, 
epoch  37 summary: tot_dyn_loss   : 0.02315, 
epoch  38 summary: tot_dyn_loss   : 0.02323, 
epoch  39 summary: tot_dyn_loss   : 0.02323, 
epoch  40 summary: tot_dyn_loss   : 0.02312, 
valid loss: 2.836514, valid acc: 0.4292
epoch  41 summary: tot_dyn_loss   : 0.02322, 
epoch  42 summary: tot_dyn_loss   : 0.02314, 
epoch  43 summary: tot_dyn_loss   : 0.02317, 
epoch  44 summary: tot_dyn_loss   : 0.02331, 
epoch  45 summary: tot_dyn_loss   : 0.02323, 
epoch  46 summary: tot_dyn_loss   : 0.02317, 
epoch  47 summary: tot_dyn_loss   : 0.02321, 
epoch  48 summary: tot_dyn_loss   : 0.02324, 
epoch  49 summary: tot_dyn_loss   : 0.02326, 
valid loss: 2.845094, valid acc: 0.4175
all                           6903.861ms
all_epoch                     6888.535ms
all_preparation                 15.317ms
all_preparation_2               14.052ms
all_preparation_3                1.255ms
epoch                           64.013ms
epoch_pos_train                  1.290ms
epoch_preparation                0.309ms
epoch_train                     62.068ms
epoch_valid                      0.174ms
----------------------------------------
all                           6903.861ms
  all_epoch             99.78%
  all_preparation        0.22%
all_preparation                 15.317ms
  all_preparation_2     91.74%
  all_preparation_3      8.19%
epoch                         3200.633ms
  epoch_train           96.96%
  epoch_pos_train        2.02%
  epoch_preparation      0.48%
  epoch_valid            0.27%
